title,author,genre,description,category,rating,maturity rating,page count
The Invisible Man,"['Len Jenkin', 'Herbert George Wells']",mystery,No description,No category,0,Not rated,No data
Where are the Children?,['Mary Higgins Clark'],mystery,A mother is accused in the gruesome deaths of her two children.,['FICTION'],3.5,NOT_MATURE,302
Deja Dead,['Kathy Reichs'],mystery,"""Fans of TV's CSI: Crime Scene Investigation should be in heaven"" (People) stepping into the world of forensic anthropologist Dr. Temperance Brennan, star of Kathy Reichs's electrifyingly authentic bestsellers. Her life is devoted to justice -- for those she never even knew. In the year since Temperance Brennan left behind a shaky marriage in North Carolina, work has often preempted her weekend plans to explore Quebec. When a female corpse is discovered meticulously dismembered and stashed in trash bags, Tempe detects an alarming pattern -- and she plunges into a harrowing search for a killer. But her investigation is about to place those closest to her -- her best friend and her own daughter -- in mortal danger....",['Fiction'],4,NOT_MATURE,422
"""A"" is for Alibi",['Sue Grafton'],mystery,"Laurence Fife was a slick divorce lawyer and slippery ladies' man. Until someone killed him. The jury believed that it was his pretty young wife Nikki, so they sent her to prison for eight years. Now, Nikki's out on parole and Kinsey Miihone's in for trouble. Nikki hires Kinsey to discover who really killed her husband. But the trail is eight years cold, and at the end is a chilling twist even Kinsey doesn't suspect -- a second eight-year-old murder and a brand new corpse. Copyright © Libri GmbH. All rights reserved.",['Fiction'],3.5,NOT_MATURE,294
A Murder is Announced,['Agatha Christie'],mystery,"A childish practical joke? Or a hoax intended to scare poor Letitia Blacklock? Unable to resist the mysterious invitation, a crowd begins to gather at Little Paddocks at the appointed time when, without warning, the lights go out...",['Detective and mystery stories'],3.5,NOT_MATURE,244
A Time to Kill,['John Grisham'],mystery,Courtroom drama of an inhuman crime.,['Fiction'],4,NOT_MATURE,528
Tyrannosaur Canyon,['Douglas Preston'],mystery,"A moon rock missing for thirty years... Five buckets of blood-soaked sand found in a New Mexico canyon... A scientist with ambition enough to kill... A monk who will redeem the world... A dark agency with a deadly mission... The greatest scientific discovery of all time... What fire bolt from the galactic dark shattered the Earth eons ago, and now hides in that remote cleft in the southwest U.S. known as . . . Tyrannosaur Canyon? The stunning new masterwork from the acclaimed best-selling author, recently hailed by Publishers Weekly as ""better than Crichton.""",['Fiction'],3.5,NOT_MATURE,382
Still Life,['Louise Penny'],mystery,"In a small town in Quebec a women supposedly loved by her community is found in the woods, murdered. Chief Inspector Armand Gamache looks for the small clues which will point him to the killer.",['Fiction'],3.5,NOT_MATURE,324
The Road to Gandolfo,['Robert Ludlum'],mystery,A humourous tale where the premis is to kidnap Pope Francesco I and ransom him off for every catholic in the world.,['Adventure stories'],3.5,NOT_MATURE,312
Ricochet,['Sandra Brown'],mystery,"Detective Sergeant Duncan Hatcher knows he must exercise discretion when investigating a fatal shooting at the home of Judge Cato Laird, but he is both suspicious of and attracted to the Judge's wife.","['Authors, American']",5,NOT_MATURE,401
Plum Lovin',['Janet Evanovich'],mystery,"Receiving simultaneous caches of love letters and hate mail, Connie Rosolli enlists the aid of Lula, Grandma Mazur, and the enigmatic Diesel when she becomes suspicious that her secret admirer and stalker are the same person.",['Fiction'],3,NOT_MATURE,292
Crime and Punishment,['Fyodor Dostoyevsky'],mystery,No description,No category,0,Not rated,No data
Agatha Raisin and the Witch of Wyckhadden,['M. C. Beaton'],mystery,"After being shaved bald during a previous case, Agatha Raisin goes to a seaside resort and enlists the aid of a local witch to grow her hair back, putting her right in the middle of things when the witch is found dead. Reprint.",['Fiction'],3.5,NOT_MATURE,228
"Loves Music, Loves to Dance",['Mary Higgins Clark'],mystery,"When Robin probes the disappearance of her close friend, Marcy, a young woman who answers an ad in a magazine ""personals"" section, she finds herself the prey of a serial killer with a special fetish",['Fiction'],3.5,NOT_MATURE,341
And Then There Were None,['Agatha Christie'],mystery,"One by one, the guests arrived at the mansion on Indian Island, summoned by a mysterious host. And one by one, with terrifying meticulousness, they were stalked by a cunning murderer. Utterly baffling...and yet there was a pattern, concealed in a nursery rhyme hanging over the fireplace.",['Fiction'],4,NOT_MATURE,294
The Night Manager,['John Le Carré'],mystery,"Former British intelligence officer Jonathan Pine attempts to infiltrate the entourage of Roper, a sinister and powerful Englishman responsible for fitting together the pieces for a monumental arms-for-cocaine deal. Reprint.",['Fiction'],3.5,NOT_MATURE,518
A Purple Place for Dying,['John Dann MacDonald'],mystery,"A Purple Place for Dying is the third book in John MacDonald's Travis McGee series, and McGee comes upon his most troubling case yet. McGee is brought to the Midwest by a big, brassy, bossy Blonde who needs help. Mona Yeoman suspects that her husband has pilfered her trust fund, and she wants a divorce. McGee's job is to find out what happened to the money. McGee doesn't particularly like Yeoman, but is tempted to take the case because he needs the money. But before he even has a chance to say yes, Mona is murdered right in front of his eyes, and this changes everything. What makes things even more mysterious is that her body disappears when the police are called to the scene of the crime.",['Detective and mystery stories'],4.5,NOT_MATURE,241
Himself,['Jess Kidd'],mystery,"""""A highly unusual tale set in a highly unusual Irish village full of dark secrets",['Fiction'],4,NOT_MATURE,400
Dashing Through the Snow,"['Mary Higgins Clark', 'Carol Higgins Clark']",mystery,"Novelist Nora Regan Reilly and her PI daughter, along with their close friends Alvirah and Will, track down a missing employee of Conklin's Market who is connected with a $180 million lottery and the winnings.",['Fiction'],3,NOT_MATURE,322
4.50 from Paddington,['Agatha Christie'],mystery,"Elspeth looked out the train window into the train drawing alongside, and was horrified to see a man strangling a woman. The body crumpled, and then the other train drew away. But no one believed Elspeth's story--except her friend Miss Marple.",['Detective and mystery stories'],4,NOT_MATURE,228
Suspicion of Innocence,['Barbara Parker'],mystery,"Edgar Award Finalist: This Miami-set crime thriller by a New York Times-bestselling author is ""an exhilarating debut and] a sizzling page-turner"" (Publishers Weekly). Gail Connor is a fast-rising attorney in a major law firm, about to make partner--until her life is derailed by the discovery of her sister's murdered body and the quick revelation that Gail herself is the prime suspect. Gail must fight for her life as she gets a firsthand look at the dark underside of the legal system. Written by a former prosecutor, Suspicion of Innocence is ""a sun-drenched variation on the work of Scott Turow and Patricia Cornwell"" (Library Journal). Suspicion of Innocence is the 1st book in the Gail Connor and Anthony Quintana series, but you may enjoy reading the series in any order.",['Fiction'],4,NOT_MATURE,0
Murder on the Orient Express,['Agatha Christie'],mystery,"Hercule Poirot observed his fellow passengers on the Orient Express: a Russian princess, an English colonel, an American with a strange glint in his eye and many more. He was looking forward to the journey. But is was not to be. After a restless night, he awoke to find that tragedy had struck.",['Detective and mystery stories'],4,NOT_MATURE,254
A Case of Need,"['Michael Crichton', 'Jeffrey Hudson']",mystery,Murder? Botched surgery? Accidental malpractice? Someone violating the Hippocratic oath? No one knows exactly ... Only one doctor is willing to push his way through the hidden medical data and secrets to learn the truth.,['Abortion'],3,NOT_MATURE,416
Brother Odd,['Dean Ray Koontz'],mystery,"Loop me in, odd one.The words, spoken in the deep of night by a sleeping child, chill the young man watching over her. For this was a favorite phrase of Stormy Llewellyn, his lost love, and Stormy is dead, gone forever from this world. In the haunted halls of the isolated monastery where he had sought peace, Odd Thomas is stalking spirits of an infinitely darker nature Through twoNew York Timesbestselling novels Odd Thomas has established himself as one of the most beloved and unique fictional heroes of our time. Now, wielding all the power and magic of a master storyteller at the pinnacle of his craft, Dean Koontz follows Odd into a singular new world where he hopes to make a fresh beginning—but where he will meet an adversary as old and inexorable as time itself. St. Bartholomew’s Abbey sits in majestic solitude amid the wild peaks of California’s high Sierra, a haven for children otherwise abandoned, and a sanctuary for those seeking insight. Odd Thomas has come here to learn to live fully again, and among the eccentric monks, their other guests, and the nuns and young students of the attached convent school, he has begun to find his way. The silent spirits of the dead who visited him in his earlier life are mercifully absent, save for the bell-ringing Brother Constantine and Odd’s steady companion, the King of Rock 'n' Roll. But trouble has a way of finding Odd Thomas, and it slinks back onto his path in the form of the sinister bodachs he has met previously, the black shades who herald death and disaster, and who come late one December night to hover above the abbey’s most precious charges. For Odd is about to face an enemy who eclipses any he has yet encountered, as he embarks on a journey of mystery, wonder, and sheer suspense that surpasses all that has come before. From the Hardcover edition.",['Colecção Suspense'],3.5,NOT_MATURE,464
True Evil,['Greg Iles'],mystery,"The idyllic life of busy Natchez doctor Chris Shepard is turned upside down when undercover FBI agent Alex Morse recruits him for a case involving a local divorce attorney who is suspected of murdering the spouses of his clients. By the author of Turning Angel. 350,000 first printing.",['Fiction'],3,NOT_MATURE,529
"""E"" is for Evidence",['Sue Grafton'],mystery,Kinsey Millhone has been framed for a crime she didn't commit and must now uncover the truth or face losing everything she has worked for.,['FICTION'],3.5,NOT_MATURE,216
Beautiful Lies,['Lisa Unger'],mystery,Divorced parents Liana Robeson and Cullen Lewellyn travel together to Australia to find their son who is missing along with the pearl of great price. The story flashbacks to the lives and tragedies of the former owners of the pearl.,['Birthfathers'],3.5,NOT_MATURE,590
The Unbreakable Code,['Jennifer Chambliss Bertman'],mystery,No description,No category,0,Not rated,No data
The ABC Murders,['Agatha Christie'],mystery,No description,No category,0,Not rated,No data
Agatha Raisin and the Fairies of Fryfam,['M. C. Beaton'],mystery,"When a prominent village resident is found murdered, Agatha Raisin ignores the talk of fairies and supernatural happenings and begins to search for an all-too-human killer. Reprint.",['Fiction'],3,NOT_MATURE,230
Tuesday,['David Wiesner'],mystery,"Frogs rise on their lily pads, float through the air, and explore nearby houses while their inhabitants sleep.",['Juvenile Fiction'],4,NOT_MATURE,36
The Curious Incident of the Dog in the Night-Time,"['Simon Stephens', 'Mark Haddon']",mystery,"Christopher, stands beside Mrs Shears's dead dog. It has been speared with a garden fork, it is seven minutes after midnight, and Christopher is under suspicion. He records each fact in the book he is writing to solve the mystery of who murdered Wellington.",['Drama'],3.5,NOT_MATURE,111
What Mrs. McGillicuddy Saw!,['Agatha Christie'],mystery,No description,No category,0,Not rated,No data
An Overdose of Death,['Agatha Christie'],mystery,No description,No category,0,Not rated,No data
The Shape of Water,['Andrea Camilleri'],mystery,Follows Sicilian detective Inspector Montalbano as he investigates the suspicious death of an engineer who had made a name for himself in a small town.,['Detective and mystery stories'],3.5,NOT_MATURE,240
The Curious Incident of the Dog in the Night-time,['Mark Haddon'],mystery,"YA. Murder mystery. Despite his overwhelming fear of interacting with people, Christopher, a mathematically-gifted, autistic fifteen-year-old boy, decides to investigate the murder of a neighbour's dog and uncovers secret information about his mother. Whitbread book of the year 2003. WAYRBA list 2005.","[""Asperger's syndrome""]",3.5,NOT_MATURE,288
Last Scene Alive,['Charlaine Harris'],mystery,"Last Scene Alive by Charlaine Harris released on Nov 24, 2003 is available now for purchase.",['Detective and mystery stories'],3,NOT_MATURE,260
To the Nines,['Janet Evanovich'],mystery,"Pursuing a skip, Stephanie travels to Las Vegas, where she meets up with Sally Sweet, Joe Morelli, and Ranger, and works to outmaneuver a trio of mobsters who are determined to prevent Stephanie's return home.",['Fiction'],4,NOT_MATURE,360
The A.B.C. Murders,['Agatha Christie'],mystery,"A is for Ascher, cudgeled in Andover. B is for Barnard, strangled in Bexhill. C is for Clarke, struck down in Churston. Beside each body is an A.B.C. Railway guide; before each murder Hercule Poirot is notified. In one of Christie's most twisted tales, the meticulous Belgian sleuth must navigate the eerie maze of a serial killer's mind. D is for Doncaster, where the next victim dies... E is for evidence, ingeniously analyzed.",['Fiction'],3.5,NOT_MATURE,252
Death on the Nile,['Agatha Christie'],mystery,No description,No category,0,Not rated,No data
Sons and Lovers,['David Herbert Lawrence'],romance,A provocative portrait of an artist torn between love for his possessive mother and desire for two young beautiful women. It is also the story of Paul Morel's growing into manhood torn by both inner and outer conflict.,['Autobiographical fiction'],3,NOT_MATURE,534
The Glass Menagerie,['Tennessee Williams'],romance,The only single edition now available of this American classic about a mother obsessed with her disabled daughter.,['Drama'],4,NOT_MATURE,132
Daughter of the Forest,['Juliet Marillier'],romance,"To reclaim the lives of her brothers, Sorcha leaves the only safe place she has known and starts on a journey of pain, loss, and terror.",['Fiction'],4,NOT_MATURE,438
Malafrena,['Ursula K. Le Guin'],romance,"Transports the reader to a Europe of the Imagination, Orsinia, when Itale Sorde is swept up in the revolutionary storms of his day, renouncing both his inheritance and the love of his life for his dream of revolution and the firey woman who wants him for her own.",['Bildungsromans'],3.5,NOT_MATURE,358
North and South,['Elizabeth Cleghorn Gaskell'],romance,No description,No category,0,Not rated,No data
No Way Out,['Fern Michaels'],romance,"Struggling to remember the accident that left her in a coma and led to her boyfriend's disappearance, video game developer Ellie Bowman starts over in rural Missouri, before an inexplicable reunion threatens everything she has rebuilt.",['Fiction'],3.5,NOT_MATURE,290
If Not for You,['Debbie Macomber'],romance,"Moving away from her oppressive parents in the hopes of taking charge of her own life, Beth takes a job as a school music teacher and initially resists her attraction to a tattooed mechanic who is the epitome of everything her conservative parents fear.",['FICTION'],4,NOT_MATURE,386
Twisted Perfection Signed Limited Edition,['Abbi Glines'],romance,No description,No category,0,Not rated,No data
Nobody's Darling,['Teresa Medeiros'],romance,"Dear Reader, I never enjoyed being a wanted man until the day Miss Esmerelda Fine marched into the Tumbleweed Saloon and pointed her derringer straight at my heart. Who would have guessed some duke's granddaughter--an awfully pretty one at that--would come gunning for the likes of me, a notorious bounty hunter with a taste for whiskey and a fondness for peach pie? Lucky for me, she was a mighty poor shot. Instead of killing me, she hired me to find her runaway brother. Little did she know she was about to make the acquaintance of a flea-bitten basset hound named Sadie, the infamous Darling Gang, and my shotgun-toting kinfolk. And little did I know she was about to lead me on a merry chase that would take us from a bungled bank robbery to the very first Wild West show to tour London, England. I should have turned down her offer. I should have resisted her charms. But I didn't. Because there comes a time in every man's life when he's got nothing left to lose...but his heart. Yours, Billy Darling",['Fiction'],4,NOT_MATURE,398
Spirit Bound,['Richelle Mead'],romance,"The international number 1 bestselling Vampire Academy series by Richelle Mead is now a major motion picture. Read it before it hits cinemas in 2014! SALVATION HAS ITS PRICE . . . Fall in love with Rose and Dimitri all over again in Spirit Bound, the anticipated fifth novel in Richelle Mead's enthralling Vampire Academy series. After a long and heartbreaking journey to Siberia, Dimitri's birthplace, Rose Hathaway has finally returned to St. Vladimir's - and to her best friend, Lissa Dragomir. It's graduation, and the girls can't wait for their real lives outside the Academy's cold iron gates to finally begin. But even with the intrigue and excitement of court life looming, Rose's heart still aches for Dimitri. He's out there, somewhere. She failed to kill him when she had the chance, and now her worst fears are about to come true. Dimitri has tasted her blood, and she knows in her heart that he is hunting her. And if Rose won't join him, he won't rest until he has silenced her . . . forever. But Rose can't forget what she learned on her journey - whispers of a magic too impossible and terrifying to comprehend. A magic inextricably tied to Lissa that could hold the answer to all of Rose's prayers, but not without devastating consequences. Now Rose will have to decide what - and who - matters most to her. And in the end, is true love really worth the price? penguinteenaustralia.com",['Boarding school students'],4.5,NOT_MATURE,489
It Happened One Summer,['Tessa Bailey'],romance,No description,No category,0,Not rated,No data
Maggy's Child,['Karen Robards'],romance,"Maggy, having endured twelve years in an abusive marriage to the much older Lyle Forrest for the sake of her son David, finds her defenses crumbling when Nick, her first love and the father of her child, returns to claim her.",['Domestic fiction'],3,NOT_MATURE,418
Simple Gifts,"['Judith McNaught', 'Jude Deveraux']",romance,4 Heartwarming Christmas Stories.,['Fiction'],3.5,NOT_MATURE,406
All Your Perfects,['Colleen Hoover'],romance,No description,No category,0,Not rated,No data
Highland Beast,"['Hannah Howell', 'Victoria Dahl']",romance,"Forbidden longings and paranormal passions, in three stories set in the Scottish highlands. Witches, vampires and demons face their all-consuming quests-- and their primitive lusts.",['Demonology'],3.5,NOT_MATURE,352
White Hot,['Sandra Brown'],romance,"When her younger brother commits suicide, Sayre Lynch returns to her hometown for the funeral and finds herself drawn into a web cast by her controlling and tyrranical father.",['Brothers'],3.5,NOT_MATURE,696
Anchored Hearts,['Priscilla Oliveras'],romance,"""Sparks fly for a second time when award-winning photographer and prodigal son Alejandro ends up back home, forced to face the familia--and the girl he left behind--for the first time in years. Can these two Key West natives learn to put away old hurts and embrace a new future under the tropical sun?""--",['Fiction'],4,NOT_MATURE,338
Pride and Prejudice,['Jane Austen'],romance,No description,No category,0,Not rated,No data
West Side Story,['Irving Shulman'],romance,"From the silver screen to the Great White Way--one of the greatest stories of all time. They came together through love but violence threatened to tear them apart. Maria was young and innocent and had never known love--until Tony. And he, who had been seeking something beyond the savagery of the streets, discovered it with her. But Maria's brother was leader of the Sharks and Tony had once led the rival Jets. Now both gangs were claiming the same turf. Tony promised Maria that he would stay out of it. Would he be able to keep his word? Or would their newfound love be destroyed by sudden death?",['Fiction'],4,NOT_MATURE,166
The Princess Diaries,['Meg Cabot'],romance,"Just in time for the Disney feature-film release comes the paperback edition of ""The Princess Diaries""--the story of a 14-year-old high school girl who discovers she's the crown princess of a European principality.",['Juvenile Fiction'],3.5,NOT_MATURE,322
Sense and Sensibility,['Jane Austen'],romance,Classics with legible texts you can actually read at a fantastic price.,['Books and reading'],4.5,NOT_MATURE,0
Above and Beyond,['Sandra Brown'],romance,Trevor's love for Kyla--the widow of his best friend--is complicated by a secret that threatens to destroy their fragile relationship,['Fiction'],4,NOT_MATURE,297
Captivated,['Nora Roberts'],romance,His interest in her was purely professional ... or so he told himself.,['Donovan family (Fictitious characters)'],4,NOT_MATURE,312
A Loving Scoundrel,['Johanna Lindsey'],romance,"Danny grew up on the streets of London as a pickpocket, but Jeremy Malory rescues her and hires her as his upstairs maid.",['Criminals'],4,NOT_MATURE,528
Emma,['Jane Austen'],romance,Emma tries to impose her match making ideas on everyone and finds that sometimes she should desist.,['England'],4,NOT_MATURE,422
An Offer from a Gentleman,['Julia Quinn'],romance,Synopsis coming soon.......,['Fiction'],4,NOT_MATURE,480
The Christmas Wedding Ring,['Susan Mallery'],romance,"As a girl, Molly Anderson had a crush on her older sister's boyfriend, Dylan Black, and, now grown, recovering from an engagement broken just before Christmas, and hiding a secret, she seeks him out and they begin a new relationship.",['Fiction'],3.5,NOT_MATURE,265
Persuasion,['Jane Austen'],romance,Classics with legible texts you can actually read at a fantastic price.,['Books and reading'],4.5,NOT_MATURE,0
The Dogs and the Wolves,['Irène Némirovsky'],romance,"A wonderful, panoramic novel and an achingly poignant love story from the bestselling author of Suite Française.",['Bankers'],3.5,NOT_MATURE,227
Emma,['Jane Austen'],romance,Classics with legible texts you can actually read at a fantastic price.,['England'],4,NOT_MATURE,512
Lie Down in Darkness,['William Styron'],romance,"As Milton Loftis follows the hearse in which his beautiful daughter, Peyton, is being carried to the grave, a story unfolds about the degeneration of a tormented Southern family submerged in infidelity and vengeful love",['Fiction'],3,NOT_MATURE,408
Me and Mr Jones,['Lucy Diamond'],romance,No description,No category,0,Not rated,No data
Waiting,['Ha Jin'],romance,"For more than seventeen years, Lin Kong, a devoted and ambitious doctor, has been in love with an educated, clever, modern woman, Manna Wu. But back in his traditional home village lives the humble, loyal wife his family chose for him years ago. Every summer, he returns to ask her for a divorce and every summer his compliant wife agrees but then backs out. This time, after eighteen years' waiting, Lin promises it will be different.",['American fiction'],3,NOT_MATURE,322
My Scandalous Bride,"['Christina Dodd', 'Stephanie Laurens', 'Celeste Bradley', 'Leslie Lafoy']",romance,"The passion is endless and it's only just begun in these four scintillating tales of brides-to-be by four of today's hottest romance authors... My Scandalous Bride Christina Dodd, ""The Lady and the Tiger"" Laura Haver will stop at nothing to find out who killed her brother-even if it means posing as the wife of notorious rogue Keefe Leighton, the Earl of Hamilton. But things go too far when Keefe engages Laura in an artful game of seduction-a game that can have only one winner... Stephanie Laurens, ""Melting Ice"" Once, Dyan St. Laurent Dare, Duke of Darke, dreamed of making Lady Fiona his bride. Now they're together again-at a scandalous dinner party where debauchery is the menu's main course. But will wedding bells ring after the guests get their just desserts? Celeste Bradley, ""Wedding Knight"" Alfred Knight will do anything to avoid a scandal-even marry a woman he barely knows. But his bride has a most titillating secret...one she'll share as soon as she conquers her temptation for the man she was never supposed to marry! Leslie LaFoy, ""The Proposition"" Rennick St. James, the Earl of Parnell, has four days to seduce London's most popular widow into becoming his wife-or else she'll marry another man. It won't be easy...but Rennick has been lusting after the beguiling Julia Hamilton far too long to let her go now... Look Inside for an Excerpt to Christina Dodd's brand new contemporary romance",['Fiction'],4.5,NOT_MATURE,356
Mansfield Park,['Jane Austen'],romance,No description,No category,0,Not rated,No data
The House of the Seven Gables,"['Nathaniel Hawthorne', 'Philip Young']",romance,No description,No category,0,Not rated,No data
