title,author,genre,description,category,rating,maturity rating,page count
Cell,['Stephen King'],horror,"Clayton Riddell, an artist from Maine, has just landed a deal that might finally enable him to support his family by making art instead of teaching it. Clay's feeling good about the future. That changes in a hurry ... The cause of the devastation is a phenomenon that will come to be known as The Pulse, and the delivery method is a cell phone. Everyone's cell phone.",['Cell phones'],3,NOT_MATURE,718
Unnatural Creatures,['Neil Gaiman'],horror,"The griffin, the sunbird, manticores, unicorns ­- all manner of glorious creatures never captured in zoos, museums or photographs are packed vividly into this collection of stories. Neil Gaiman has included some of his own childhood favourites alongside stories classic and modern to spark the imagination of readers young and old. All contributors have given their work free to benefit Dave Eggers' literacy charity, 826DC. Also includes a new Neil Gaiman Story.","['Animals, Mythical']",4,NOT_MATURE,481
The Waste Lands,['Stephen King'],horror,"Roland, the Last Gunslinger, moves closer to The Dark Tower of his dreams and nightmares through a world of the fiendish foes.",['Epic fiction'],4,NOT_MATURE,596
Spiral,"['Kōji Suzuki', 'Glynne Walley']",horror,"Learning about a series of mysterious deaths caused by an unknown virus, Ando, a physician, faces the choice of finding a cure for the virus or using the information he has gathered to help bring his drowned son back from the dead.",['Fiction'],2.5,NOT_MATURE,283
The M.D.,['Thomas M. Disch'],horror,"After coming into possession of a caduceus gifted with extraordinary powers for good or evil as a child, Billy Michaels becomes increasingly addicted to the power as he learns to use and control the caduceus",['Horror'],3.5,NOT_MATURE,432
The Merry Spinster,"['Daniel M. Lavery', 'Mallory Ortberg']",horror,"From Mallory Ortberg comes a collection of darkly mischievous stories based on classic fairy tales. Adapted from the beloved ""Children's Stories Made Horrific"" series, ""The Merry Spinster"" takes up the trademark wit that endeared Ortberg to readers of both The Toast and the best-selling debut Texts From Jane Eyre. The feature has become among the most popular on the site, with each entry bringing in tens of thousands of views, as the stories proved a perfect vehicle for Ortberg's eye for deconstruction and destabilization. Sinister and inviting, familiar and alien all at the same time, The Merry Spinster updates traditional children's stories and fairy tales with elements of psychological horror, emotional clarity, and a keen sense of feminist mischief. Readers of The Toast will instantly recognize Ortberg's boisterous good humor and uber-nerd swagger: those new to Ortberg's oeuvre will delight in this collection's unique spin on fiction, where something a bit mischievous and unsettling is always at work just beneath the surface. Unfalteringly faithful to its beloved source material, The Merry Spinster also illuminates the unsuspected, and frequently, alarming emotional complexities at play in the stories we tell ourselves, and each other, as we tuck ourselves in for the night. Bed time will never be the same.",['Fiction'],3.5,NOT_MATURE,208
All Our Hidden Gifts,"[""Caroline O'Donoghue""]",horror,"Maeve Chambers doesn't have much going for her. Not only does she feel like the sole idiot in a family of geniuses, she managed to drive away her best friend Lily a year ago. But when she finds a pack of dusty old tarot cards at school, and begins to give scarily accurate readings to the girls in her class, she realizes she's found her gift at last. Things are looking up - until she discovers a strange card in the deck that definitely shouldn't be there. And two days after she convinces her ex-best friend to have a reading, Lily disappears. Can Maeve, her new friend Fiona and Lily's brother Roe find her? And will Maeve's new gift be enough to bring Lily back, before she's gone for good?",['Young Adult Fiction'],4,NOT_MATURE,385
Different Seasons,['Stephen King'],horror,A Stephen King novel telling of unfair imprisonment and escape.,['Castle Rock (Me. : Imaginary place)'],4,NOT_MATURE,560
Firestarter,['Stephen King'],horror,"From the author of THE SHINING, CARRIE and THE DEAD ZONE, this is Stephen King's most mesmerizing and menacing novel yet...It is the story of a sinister government agency, a fteful drug experiment, and a pigtailed girl named Charlie, who has an unimaginably terrifying gift. As PLAYBOY said, 'King does this better than anyone else. We finished the book about three non-stop hours after we picked it up.",['Horror fiction'],3.5,NOT_MATURE,510
The Dead Zone,['Stephen King'],horror,No description,No category,0,Not rated,No data
Frankenstein Or the Modern Prometheus,['Mary Wollstonecraft Shelley'],horror,No description,No category,0,Not rated,No data
Danse Macabre,['Stephen King'],horror,"Information on the horror phenomenon including books, movies, radio, and T.V.",['Horror in mass media'],3.5,NOT_MATURE,400
Cold Fire,['Dean Ray Koontz'],horror,"Reporter Holly Thorne investigates the case of Jim Ironheart, who has saved six lives in different parts of the country in three months, with the help of a force that suddenly turns against both of them",['Fiction'],3.5,NOT_MATURE,382
The Dream-quest of Unknown Kadath,['Howard Phillips Lovecraft'],horror,"Six bone-chilling tales of bizarre beauty and awesome horror lurk in the dark of the soul, waiting to be called upon by the demons of nightmares, and let loose in the frightened mind. Only H.P. Lovecraft could conjure up these testaments to evil that will live inside of you forever.... Copyright © Libri GmbH. All rights reserved.",['Horror'],4.5,NOT_MATURE,260
Everyone Loves a Good Train Wreck,['Eric Wilson'],horror,An analysis of the human attraction to darker areas of life draws on findings in a wide range of disciplines and cites diverse examples to conclude that people experience renewal when they confront pain and death. By the author of Against Happiness.,['Psychology'],2,NOT_MATURE,225
Welcome to Dead House,['R. L. Stine'],horror,"When their father inherits an old house in the town of Dark Falls, Amanda and Josh are excited--until they begin to suspect that the house is haunted.",['Juvenile Fiction'],3.5,NOT_MATURE,144
Pouvoirs de L'horreur (English),['Julia Kristeva'],horror,Essay,['Literary Criticism'],5,NOT_MATURE,236
Forever Odd,['Dean Ray Koontz'],horror,"In the unique world of Pico, Odd--an unforgettable hero who lives between the living and the dead--takes a stand against evil in a battle where there are no innocent bystanders. Reprint.",['Fiction'],3.5,NOT_MATURE,364
The Stand,['Stephen King'],horror,"For use in schools and libraries only. A monumentally devastating plague leaves only a few survivors who, in a desert world, experience dreams of good and evil in confrontation and, through their choices, move toward an actual confrontation.",['Good and evil'],4,NOT_MATURE,817
The Barking Ghost,['R. L. Stine'],horror,"People say Cooper Holmes is scared of his own shadow, but when the Holmeses move into a new house deep in the woods, scary things really do start happening and no one will believe Cooper.",['Dogs'],2.5,NOT_MATURE,130
Stay Out of the Basement,['R. L. Stine'],horror,"With their father conducting strange experiments with plants in the basement, Margaret and Casey begin to investigate and soon discover that their father has begun to resemble a plant.",['Juvenile Fiction'],3.5,NOT_MATURE,122
Night of the Gargoyles,['Eve Bunting'],horror,"Ominous b/w illus. When night comes, the gargoyles on a museum building come alive.",['Gargoyles'],3,NOT_MATURE,36
The Invisible Man,"['Len Jenkin', 'Herbert George Wells']",mystery,No description,Not specified,0,Not rated,No data
Where are the Children?,['Mary Higgins Clark'],mystery,A mother is accused in the gruesome deaths of her two children.,['FICTION'],3.5,NOT_MATURE,302
Deja Dead,['Kathy Reichs'],mystery,"""Fans of TV's CSI: Crime Scene Investigation should be in heaven"" (People) stepping into the world of forensic anthropologist Dr. Temperance Brennan, star of Kathy Reichs's electrifyingly authentic bestsellers. Her life is devoted to justice -- for those she never even knew. In the year since Temperance Brennan left behind a shaky marriage in North Carolina, work has often preempted her weekend plans to explore Quebec. When a female corpse is discovered meticulously dismembered and stashed in trash bags, Tempe detects an alarming pattern -- and she plunges into a harrowing search for a killer. But her investigation is about to place those closest to her -- her best friend and her own daughter -- in mortal danger....",['Fiction'],4,NOT_MATURE,422
"""A"" is for Alibi",['Sue Grafton'],mystery,"Laurence Fife was a slick divorce lawyer and slippery ladies' man. Until someone killed him. The jury believed that it was his pretty young wife Nikki, so they sent her to prison for eight years. Now, Nikki's out on parole and Kinsey Miihone's in for trouble. Nikki hires Kinsey to discover who really killed her husband. But the trail is eight years cold, and at the end is a chilling twist even Kinsey doesn't suspect -- a second eight-year-old murder and a brand new corpse. Copyright © Libri GmbH. All rights reserved.",['Fiction'],3.5,NOT_MATURE,294
A Murder is Announced,['Agatha Christie'],mystery,"A childish practical joke? Or a hoax intended to scare poor Letitia Blacklock? Unable to resist the mysterious invitation, a crowd begins to gather at Little Paddocks at the appointed time when, without warning, the lights go out...",['Detective and mystery stories'],3.5,NOT_MATURE,244
A Time to Kill,['John Grisham'],mystery,Courtroom drama of an inhuman crime.,['Fiction'],4,NOT_MATURE,528
Tyrannosaur Canyon,['Douglas Preston'],mystery,"A moon rock missing for thirty years... Five buckets of blood-soaked sand found in a New Mexico canyon... A scientist with ambition enough to kill... A monk who will redeem the world... A dark agency with a deadly mission... The greatest scientific discovery of all time... What fire bolt from the galactic dark shattered the Earth eons ago, and now hides in that remote cleft in the southwest U.S. known as . . . Tyrannosaur Canyon? The stunning new masterwork from the acclaimed best-selling author, recently hailed by Publishers Weekly as ""better than Crichton.""",['Fiction'],3.5,NOT_MATURE,382
Still Life,['Louise Penny'],mystery,"In a small town in Quebec a women supposedly loved by her community is found in the woods, murdered. Chief Inspector Armand Gamache looks for the small clues which will point him to the killer.",['Fiction'],3.5,NOT_MATURE,324
The Road to Gandolfo,['Robert Ludlum'],mystery,A humourous tale where the premis is to kidnap Pope Francesco I and ransom him off for every catholic in the world.,['Adventure stories'],3.5,NOT_MATURE,312
Ricochet,['Sandra Brown'],mystery,"Detective Sergeant Duncan Hatcher knows he must exercise discretion when investigating a fatal shooting at the home of Judge Cato Laird, but he is both suspicious of and attracted to the Judge's wife.","['Authors, American']",5,NOT_MATURE,401
Plum Lovin',['Janet Evanovich'],mystery,"Receiving simultaneous caches of love letters and hate mail, Connie Rosolli enlists the aid of Lula, Grandma Mazur, and the enigmatic Diesel when she becomes suspicious that her secret admirer and stalker are the same person.",['Fiction'],3,NOT_MATURE,292
Crime and Punishment,['Fyodor Dostoyevsky'],mystery,No description,Not specified,0,Not rated,No data
Agatha Raisin and the Witch of Wyckhadden,['M. C. Beaton'],mystery,"After being shaved bald during a previous case, Agatha Raisin goes to a seaside resort and enlists the aid of a local witch to grow her hair back, putting her right in the middle of things when the witch is found dead. Reprint.",['Fiction'],3.5,NOT_MATURE,228
"Loves Music, Loves to Dance",['Mary Higgins Clark'],mystery,"When Robin probes the disappearance of her close friend, Marcy, a young woman who answers an ad in a magazine ""personals"" section, she finds herself the prey of a serial killer with a special fetish",['Fiction'],3.5,NOT_MATURE,341
And Then There Were None,['Agatha Christie'],mystery,"One by one, the guests arrived at the mansion on Indian Island, summoned by a mysterious host. And one by one, with terrifying meticulousness, they were stalked by a cunning murderer. Utterly baffling...and yet there was a pattern, concealed in a nursery rhyme hanging over the fireplace.",['Fiction'],4,NOT_MATURE,294
The Night Manager,['John Le Carré'],mystery,"Former British intelligence officer Jonathan Pine attempts to infiltrate the entourage of Roper, a sinister and powerful Englishman responsible for fitting together the pieces for a monumental arms-for-cocaine deal. Reprint.",['Fiction'],3.5,NOT_MATURE,518
A Purple Place for Dying,['John Dann MacDonald'],mystery,"A Purple Place for Dying is the third book in John MacDonald's Travis McGee series, and McGee comes upon his most troubling case yet. McGee is brought to the Midwest by a big, brassy, bossy Blonde who needs help. Mona Yeoman suspects that her husband has pilfered her trust fund, and she wants a divorce. McGee's job is to find out what happened to the money. McGee doesn't particularly like Yeoman, but is tempted to take the case because he needs the money. But before he even has a chance to say yes, Mona is murdered right in front of his eyes, and this changes everything. What makes things even more mysterious is that her body disappears when the police are called to the scene of the crime.",['Detective and mystery stories'],4.5,NOT_MATURE,241
Himself,['Jess Kidd'],mystery,"""""A highly unusual tale set in a highly unusual Irish village full of dark secrets",['Fiction'],4,NOT_MATURE,400
Dashing Through the Snow,"['Mary Higgins Clark', 'Carol Higgins Clark']",mystery,"Novelist Nora Regan Reilly and her PI daughter, along with their close friends Alvirah and Will, track down a missing employee of Conklin's Market who is connected with a $180 million lottery and the winnings.",['Fiction'],3,NOT_MATURE,322
4.50 from Paddington,['Agatha Christie'],mystery,"Elspeth looked out the train window into the train drawing alongside, and was horrified to see a man strangling a woman. The body crumpled, and then the other train drew away. But no one believed Elspeth's story--except her friend Miss Marple.",['Detective and mystery stories'],4,NOT_MATURE,228
Suspicion of Innocence,['Barbara Parker'],mystery,"Edgar Award Finalist: This Miami-set crime thriller by a New York Times-bestselling author is ""an exhilarating debut and] a sizzling page-turner"" (Publishers Weekly). Gail Connor is a fast-rising attorney in a major law firm, about to make partner--until her life is derailed by the discovery of her sister's murdered body and the quick revelation that Gail herself is the prime suspect. Gail must fight for her life as she gets a firsthand look at the dark underside of the legal system. Written by a former prosecutor, Suspicion of Innocence is ""a sun-drenched variation on the work of Scott Turow and Patricia Cornwell"" (Library Journal). Suspicion of Innocence is the 1st book in the Gail Connor and Anthony Quintana series, but you may enjoy reading the series in any order.",['Fiction'],4,NOT_MATURE,0
Murder on the Orient Express,['Agatha Christie'],mystery,"Hercule Poirot observed his fellow passengers on the Orient Express: a Russian princess, an English colonel, an American with a strange glint in his eye and many more. He was looking forward to the journey. But is was not to be. After a restless night, he awoke to find that tragedy had struck.",['Detective and mystery stories'],4,NOT_MATURE,254
A Case of Need,"['Michael Crichton', 'Jeffrey Hudson']",mystery,Murder? Botched surgery? Accidental malpractice? Someone violating the Hippocratic oath? No one knows exactly ... Only one doctor is willing to push his way through the hidden medical data and secrets to learn the truth.,['Abortion'],3,NOT_MATURE,416
Brother Odd,['Dean Ray Koontz'],mystery,"Loop me in, odd one.The words, spoken in the deep of night by a sleeping child, chill the young man watching over her. For this was a favorite phrase of Stormy Llewellyn, his lost love, and Stormy is dead, gone forever from this world. In the haunted halls of the isolated monastery where he had sought peace, Odd Thomas is stalking spirits of an infinitely darker nature Through twoNew York Timesbestselling novels Odd Thomas has established himself as one of the most beloved and unique fictional heroes of our time. Now, wielding all the power and magic of a master storyteller at the pinnacle of his craft, Dean Koontz follows Odd into a singular new world where he hopes to make a fresh beginning—but where he will meet an adversary as old and inexorable as time itself. St. Bartholomew’s Abbey sits in majestic solitude amid the wild peaks of California’s high Sierra, a haven for children otherwise abandoned, and a sanctuary for those seeking insight. Odd Thomas has come here to learn to live fully again, and among the eccentric monks, their other guests, and the nuns and young students of the attached convent school, he has begun to find his way. The silent spirits of the dead who visited him in his earlier life are mercifully absent, save for the bell-ringing Brother Constantine and Odd’s steady companion, the King of Rock 'n' Roll. But trouble has a way of finding Odd Thomas, and it slinks back onto his path in the form of the sinister bodachs he has met previously, the black shades who herald death and disaster, and who come late one December night to hover above the abbey’s most precious charges. For Odd is about to face an enemy who eclipses any he has yet encountered, as he embarks on a journey of mystery, wonder, and sheer suspense that surpasses all that has come before. From the Hardcover edition.",['Colecção Suspense'],3.5,NOT_MATURE,464
True Evil,['Greg Iles'],mystery,"The idyllic life of busy Natchez doctor Chris Shepard is turned upside down when undercover FBI agent Alex Morse recruits him for a case involving a local divorce attorney who is suspected of murdering the spouses of his clients. By the author of Turning Angel. 350,000 first printing.",['Fiction'],3,NOT_MATURE,529
"""E"" is for Evidence",['Sue Grafton'],mystery,Kinsey Millhone has been framed for a crime she didn't commit and must now uncover the truth or face losing everything she has worked for.,['FICTION'],3.5,NOT_MATURE,216
Beautiful Lies,['Lisa Unger'],mystery,Divorced parents Liana Robeson and Cullen Lewellyn travel together to Australia to find their son who is missing along with the pearl of great price. The story flashbacks to the lives and tragedies of the former owners of the pearl.,['Birthfathers'],3.5,NOT_MATURE,590
The Unbreakable Code,['Jennifer Chambliss Bertman'],mystery,No description,Not specified,0,Not rated,No data
The ABC Murders,['Agatha Christie'],mystery,No description,Not specified,0,Not rated,No data
Agatha Raisin and the Fairies of Fryfam,['M. C. Beaton'],mystery,"When a prominent village resident is found murdered, Agatha Raisin ignores the talk of fairies and supernatural happenings and begins to search for an all-too-human killer. Reprint.",['Fiction'],3,NOT_MATURE,230
Tuesday,['David Wiesner'],mystery,"Frogs rise on their lily pads, float through the air, and explore nearby houses while their inhabitants sleep.",['Juvenile Fiction'],4,NOT_MATURE,36
The Curious Incident of the Dog in the Night-Time,"['Simon Stephens', 'Mark Haddon']",mystery,"Christopher, stands beside Mrs Shears's dead dog. It has been speared with a garden fork, it is seven minutes after midnight, and Christopher is under suspicion. He records each fact in the book he is writing to solve the mystery of who murdered Wellington.",['Drama'],3.5,NOT_MATURE,111
What Mrs. McGillicuddy Saw!,['Agatha Christie'],mystery,No description,Not specified,0,Not rated,No data
An Overdose of Death,['Agatha Christie'],mystery,No description,Not specified,0,Not rated,No data
The Shape of Water,['Andrea Camilleri'],mystery,Follows Sicilian detective Inspector Montalbano as he investigates the suspicious death of an engineer who had made a name for himself in a small town.,['Detective and mystery stories'],3.5,NOT_MATURE,240
The Curious Incident of the Dog in the Night-time,['Mark Haddon'],mystery,"YA. Murder mystery. Despite his overwhelming fear of interacting with people, Christopher, a mathematically-gifted, autistic fifteen-year-old boy, decides to investigate the murder of a neighbour's dog and uncovers secret information about his mother. Whitbread book of the year 2003. WAYRBA list 2005.","[""Asperger's syndrome""]",3.5,NOT_MATURE,288
Last Scene Alive,['Charlaine Harris'],mystery,"Last Scene Alive by Charlaine Harris released on Nov 24, 2003 is available now for purchase.",['Detective and mystery stories'],3,NOT_MATURE,260
To the Nines,['Janet Evanovich'],mystery,"Pursuing a skip, Stephanie travels to Las Vegas, where she meets up with Sally Sweet, Joe Morelli, and Ranger, and works to outmaneuver a trio of mobsters who are determined to prevent Stephanie's return home.",['Fiction'],4,NOT_MATURE,360
The A.B.C. Murders,['Agatha Christie'],mystery,"A is for Ascher, cudgeled in Andover. B is for Barnard, strangled in Bexhill. C is for Clarke, struck down in Churston. Beside each body is an A.B.C. Railway guide; before each murder Hercule Poirot is notified. In one of Christie's most twisted tales, the meticulous Belgian sleuth must navigate the eerie maze of a serial killer's mind. D is for Doncaster, where the next victim dies... E is for evidence, ingeniously analyzed.",['Fiction'],3.5,NOT_MATURE,252
Death on the Nile,['Agatha Christie'],mystery,No description,Not specified,0,Not rated,No data
Sons and Lovers,['David Herbert Lawrence'],romance,A provocative portrait of an artist torn between love for his possessive mother and desire for two young beautiful women. It is also the story of Paul Morel's growing into manhood torn by both inner and outer conflict.,['Autobiographical fiction'],3,NOT_MATURE,534
The Glass Menagerie,['Tennessee Williams'],romance,The only single edition now available of this American classic about a mother obsessed with her disabled daughter.,['Drama'],4,NOT_MATURE,132
Daughter of the Forest,['Juliet Marillier'],romance,"To reclaim the lives of her brothers, Sorcha leaves the only safe place she has known and starts on a journey of pain, loss, and terror.",['Fiction'],4,NOT_MATURE,438
Malafrena,['Ursula K. Le Guin'],romance,"Transports the reader to a Europe of the Imagination, Orsinia, when Itale Sorde is swept up in the revolutionary storms of his day, renouncing both his inheritance and the love of his life for his dream of revolution and the firey woman who wants him for her own.",['Bildungsromans'],3.5,NOT_MATURE,358
North and South,['Elizabeth Cleghorn Gaskell'],romance,No description,Not specified,0,Not rated,No data
No Way Out,['Fern Michaels'],romance,"Struggling to remember the accident that left her in a coma and led to her boyfriend's disappearance, video game developer Ellie Bowman starts over in rural Missouri, before an inexplicable reunion threatens everything she has rebuilt.",['Fiction'],3.5,NOT_MATURE,290
If Not for You,['Debbie Macomber'],romance,"Moving away from her oppressive parents in the hopes of taking charge of her own life, Beth takes a job as a school music teacher and initially resists her attraction to a tattooed mechanic who is the epitome of everything her conservative parents fear.",['FICTION'],4,NOT_MATURE,386
Twisted Perfection Signed Limited Edition,['Abbi Glines'],romance,No description,Not specified,0,Not rated,No data
Nobody's Darling,['Teresa Medeiros'],romance,"Dear Reader, I never enjoyed being a wanted man until the day Miss Esmerelda Fine marched into the Tumbleweed Saloon and pointed her derringer straight at my heart. Who would have guessed some duke's granddaughter--an awfully pretty one at that--would come gunning for the likes of me, a notorious bounty hunter with a taste for whiskey and a fondness for peach pie? Lucky for me, she was a mighty poor shot. Instead of killing me, she hired me to find her runaway brother. Little did she know she was about to make the acquaintance of a flea-bitten basset hound named Sadie, the infamous Darling Gang, and my shotgun-toting kinfolk. And little did I know she was about to lead me on a merry chase that would take us from a bungled bank robbery to the very first Wild West show to tour London, England. I should have turned down her offer. I should have resisted her charms. But I didn't. Because there comes a time in every man's life when he's got nothing left to lose...but his heart. Yours, Billy Darling",['Fiction'],4,NOT_MATURE,398
