title,author,genre,description,category,rating,maturity rating,page count
The Bean Trees,['Barbara Kingsolver'],fiction,"Clear-eyed and spirited, Taylor Greer grew up poor in rural Kentucky with the goals of avoiding pregnancy and getting away. But when she heads west with high hopes and a barely functional car, she meets the human condition head-on. By the time Taylor arrives in Tucson, Arizona, she has acquired a completely unexpected child, a three-year-old American Indian girl named Turtle, and must somehow come to terms with both motherhood and the necessity for putting down roots. Hers is a story about love and friendship, abandonment and belonging, and the discovery of surprising resources in apparently empty places. Available for the first time in mass-market, this edition of Barbara Kingsolver's bestselling novel, The Bean Trees, will be in stores everywhere in September. With two different but equally handsome covers, this book is a fine addition to your Kingsolver library.",['Fiction'],4,NOT_MATURE,340
The House of the Spirits,['Isabel Allende'],fiction,The Trueba family embodies strong feelings. This family saga starts at the beginning of the 20th century and continues through the assassination of Allende in 1973.,['Fiction'],3.5,NOT_MATURE,512
The Complete Stories,['Franz Kafka'],fiction,"The Complete Stories brings together all of Kafka’s stories, from the classic tales such as “The Metamorphosis,” “In the Penal Colony,” and “A Hunger Artist” to shorter pieces and fragments that Max Brod, Kafka’s literary executor, released after Kafka’s death. With the exception of his three novels, the whole of Kafka’s narrative work is included in this volume.",['Fiction'],5,NOT_MATURE,512
Bag of Bones,['Stephen King'],fiction,"From #1 New York Times bestselling author Stephen King, a powerful tale of grief, of love's enduring bonds, and the haunting secrets of the past. Four years after the sudden death of his wife, forty-year-old bestselling novelist Mike Noonan is still grieving. Unable to write, and plagued by vivid nightmares set at the western Maine summerhouse he calls Sara Laughs, Mike reluctantly returns to the lakeside getaway. There, he finds his beloved Yankee town held in the grip of a powerful millionaire, Max Devore, whose vindictive purpose is to take his three-year-old granddaughter, Kyra, away from her widowed young mother, Mattie. As Mike is drawn into Mattie and Kyra's struggle, as he falls in love with both of them, he is also drawn into the mystery of Sara Laughs, now the site of ghostly visitations and escalating terrors. What are the forces that have been unleashed here -- and what do they want of Mike Noonan? It is no secret that King is one of our most mesmerizing storytellers. In Bag of Bones, he proves to be one of our most moving as well.",['Fiction'],4.5,NOT_MATURE,756
Lucian's True History,['Lucian (of Samosata.)'],fiction,No description,No category,0,Not rated,No data
How to Stop Time,['Matt Haig'],fiction,"From the New York Times bestselling author of The Midnight Library. “A quirky romcom dusted with philosophical observations….A delightfully witty…poignant novel.” —The Washington Post “She smiled a soft, troubled smile and I felt the whole world slipping away, and I wanted to slip with it, to go wherever she was going… I had existed whole years without her, but that was all it had been. An existence. A book with no words.” Tom Hazard has just moved back to London, his old home, to settle down and become a high school history teacher. And on his first day at school, he meets a captivating French teacher at his school who seems fascinated by him. But Tom has a dangerous secret. He may look like an ordinary 41-year-old, but owing to a rare condition, he's been alive for centuries. Tom has lived history--performing with Shakespeare, exploring the high seas with Captain Cook, and sharing cocktails with Fitzgerald. Now, he just wants an ordinary life. Unfortunately for Tom, the Albatross Society, the secretive group which protects people like Tom, has one rule: Never fall in love. As painful memories of his past and the erratic behavior of the Society's watchful leader threaten to derail his new life and romance, the one thing he can't have just happens to be the one thing that might save him. Tom will have to decide once and for all whether to remain stuck in the past, or finally begin living in the present. How to Stop Time tells a love story across the ages—and for the ages—about a man lost in time, the woman who could save him, and the lifetimes it can take to learn how to live. It is a bighearted, wildly original novel about losing and finding yourself, the inevitability of change, and how with enough time to learn, we just might find happiness. Soon to be a major motion picture starring Benedict Cumberbatch.",['Fiction'],3.5,NOT_MATURE,352
The Wife Between Us,"['Greer Hendricks', 'Sarah Pekkanen']",fiction,"A tangle of lies binds together a divorced man, his new fiancée, and his ex-wife.",['Fiction'],3,NOT_MATURE,353
The Prince and the Pauper,['Mark Twain'],fiction,No description,No category,0,Not rated,No data
Anathem,['Neal Stephenson'],fiction,"Raz, a mathematician, is among a cohort of secluded scientists and philosophers who are called upon to save the world from impending catastrophe.",['Fiction'],4,NOT_MATURE,961
"Short Letter, Long Farewell",['Peter Handke'],fiction,"By Nobel Prize Winner Peter Handke Short Letter, Long Farewell is one the most inventive and exhilarating of the great Peter Handke’s novels. Full of seedy noir atmospherics and boasting an air of generalized delirium, the book starts by introducing us to a nameless young German who has just arrived in America, where he hopes to get over the collapse of his marriage. No sooner has he arrived, however, than he discovers that his ex-wife is pursuing him. He flees, she follows, and soon the couple is running circles around each other across the length of America—from Philadelphia to St. Louis to the Arizona desert, and from Portland, Oregon, to L.A. Is it love or vengeance that they want from each other? Everything’s spectacularly unclear in a book that is travelogue, suspense story, domestic comedy, and Western showdown, with a totally unexpected Hollywood twist at the end. Above all, Short Letter, Long Farewell is a love letter to America, its landscapes and popular culture, the invitation and the threat of its newness and wildness and emptiness, with the promise of a new life—or the corpse of an old one—lying just around the corner.",['Fiction'],4,NOT_MATURE,195
The Scarlet Letter,['Nathaniel Hawthorne'],fiction,"A classic tale of love and morals in Puritan New England. The Scarlet Letter is set in 1850s Puritan Boston and tells the story of Hester Prynne, who conceives a daughter through an affair and struggles to create a new life of repentance and dignity. Throughout the book, Hawthorne explores themes of legalism, sin, and guilt. This book is required reading in many high school and college English courses and is an American classic by Nathaniel Hawthorne. This Xist Classics edition has been professionally formatted for e-readers with a linked table of contents. This eBook also contains a bonus book club leadership guide and discussion questions. We hope you’ll share this book with your friends, neighbors and colleagues and can’t wait to hear what you have to say about it. Xist Publishing is a digital-first publisher. Xist Publishing creates books for the touchscreen generation and is dedicated to helping everyone develop a lifetime love of reading, no matter what form it takes",['Fiction'],4.5,NOT_MATURE,297
The Uncensored Picture of Dorian Gray,"['Oscar Wilde', 'Nicholas Frankel']",fiction,"Over 120 years after Oscar Wilde submitted The Picture of Dorian Gray for publication, the uncensored version of his novel appears here for the first time in a paperback edition. This volume restores material, including instances of graphic homosexual content, removed by the novel’s first editor, who feared it would be “offensive” to Victorians.",['Fiction'],4,NOT_MATURE,273
Empire V,['Victor Pelevin'],fiction,"Roman thought he'd found the perfect opportunity to rebel. He may have been wrong. He awakens strapped to a set of parallel bars in a richly appointed sitting room, and begins a conversation with a masked man which will change his life. His world has been a facade - one which the mysterious Brahma is about to tear away. A stunning novel about the real world, and about the hidden chanels of power behind the scenes, EMPIRE V is a post-modern satirical novel exploring the cults and corruption of politics, banking and power. And not only are these cults difficult to join - it turns out they may be impossible to leave . . .",['Fiction'],3,NOT_MATURE,416
Adventures of Huckleberry Finn,['Samuel Langhorne Clemens'],fiction,No description,No category,0,Not rated,No data
Lilac Girls,['Martha Hall Kelly'],fiction,"NEW YORK TIMES BESTSELLER • One million copies sold! Inspired by the life of a real World War II heroine, this remarkable debut novel reveals the power of unsung women to change history in their quest for love, freedom, and second chances. “Extremely moving and memorable . . . This impressive debut should appeal strongly to historical fiction readers and to book clubs that adored Kristin Hannah’s The Nightingale and Anthony Doerr’s All the Light We Cannot See.”—Library Journal (starred review) New York socialite Caroline Ferriday has her hands full with her post at the French consulate and a new love on the horizon. But Caroline’s world is forever changed when Hitler’s army invades Poland in September 1939—and then sets its sights on France. An ocean away from Caroline, Kasia Kuzmerick, a Polish teenager, senses her carefree youth disappearing as she is drawn deeper into her role as courier for the underground resistance movement. In a tense atmosphere of watchful eyes and suspecting neighbors, one false move can have dire consequences. For the ambitious young German doctor, Herta Oberheuser, an ad for a government medical position seems her ticket out of a desolate life. Once hired, though, she finds herself trapped in a male-dominated realm of Nazi secrets and power. The lives of these three women are set on a collision course when the unthinkable happens and Kasia is sent to Ravensbrück, the notorious Nazi concentration camp for women. Their stories cross continents—from New York to Paris, Germany, and Poland—as Caroline and Kasia strive to bring justice to those whom history has forgotten. USA Today “New and Noteworthy” Book • LibraryReads Top Ten Pick",['Fiction'],4,NOT_MATURE,497
Being There,['Jerzy Kosinski'],fiction,"A quirky, brilliant novel starring Chauncey Gardiner, an enigmatic man who rises from nowhere to become a media phenomenon—“a fabulous creature of our age” (Newsweek). One of the most beloved novels by the New York Times–bestselling and National Book Award–winning author of The Painted Bird and Pinball, Being There is the story of a mysterious man who finds himself at the center of Wall Street and Washington power—including his role as a policy adviser to the president—despite the fact that no one is quite sure where he comes from, or what he is actually talking about. Nevertheless, Chauncey “Chance” Gardiner is celebrated by the media, and hailed as a visionary, in this satirical masterpiece that became an award-winning film starring Peter Sellers. As wise and timely as ever, Being There is “a tantalizing knuckleball of a book delivered with perfectly timed satirical hops and metaphysical flutters” (Time).",['Fiction'],4,NOT_MATURE,160
Time and Again,['Jack Finney'],fiction,"The 50th anniversary edition of the beloved classic that Stephen King has called “THE great time-travel story.” Featuring a brand-new introduction by the New York Times bestselling author of Recursion, Blake Crouch. When advertising artist Si Morley is recruited to join a covert government operation exploring the possibility of time travel, he jumps at the chance to leave his mundane 20th-century existence and step into the past. But he also has another motivation for going back in time: a half-burned letter that tells of a mysterious, tragic death and ominously of “fire which will destroy the whole world.” Traveling to New York City in January 1882 to investigate, he finds a Manhattan teeming with a different kind of life, the waterfront unimpeded by skyscrapers, open-air markets packed with activity, Central Park bustling with horse drawn sleighs—a city on the precipice of great things. At first, Si welcomes these trips as a temporary escape but when he falls in love with a woman he meets in the past, he must choose whether to return to modern life or live in 1882 for good. “Pure New York fun” (Alice Hoffman, New York Times bestselling author), Time and Again is meticulous recreation of New York in the late nineteenth century, exploring the possibilities of time travel to tell an ageless story of love, longing, and adventure. Finney’s magnum opus has been a source of inspiration for countless science fiction writers since its first publication in 1970.",['Fiction'],3.5,NOT_MATURE,512
Bartleby the Scrivener — A Story of Wall-Street,['Herman Melville'],fiction,"Bartleby, the Scrivener: A Story of Wall Street, also called a masterpiece of short fiction, is a short story by the American writer Herman Melville. It tells about a Wall Street lawyer who hires a new clerk who, after an initial bout of hard work, refuses to make copies or do any other task required of him, refusing with the words ""I would prefer not to.""",['Fiction'],3.5,NOT_MATURE,36
The Ghost Rider,['Ismail Kadare'],fiction,"""Ismail Kadare is one of Europe's most consistently interesting and powerful contemporary novelists, a writer whose stark, memorable prose imprints itself on the reader's consciousness."" --Los Angeles Times An old woman is awoken in the dead of night by knocks at her front door. The woman opens it to find her daughter, Doruntine, standing there alone in the darkness. She has been brought home from a distant land by a mysterious rider she claims is her brother Konstandin. But unbeknownst to her, Konstandin has been dead for years. What follows is chain of events which plunges a medieval village into fear and mistrust. Who is the ghost rider?",['Fiction'],3,NOT_MATURE,224
The Memorabilia,['Xenophon'],fiction,No description,No category,0,Not rated,No data
The Boleyn Inheritance,['Philippa Gregory'],fiction,"THREE WOMEN WHO SHARE ONE FATE: THE BOLEYN INHERITANCE ANNE OF CLEVES She runs from her tiny country, her hateful mother, and her abusive brother to a throne whose last three occupants are dead. King Henry VIII, her new husband, instantly dislikes her. Without friends, family, or even an understanding of the language being spoken around her, she must literally save her neck in a court ruled by a deadly game of politics and the terror of an unpredictable and vengeful king. Her Boleyn Inheritance: accusations and false witnesses. KATHERINE HOWARD She catches the king's eye within moments of arriving at court, setting in motion the dreadful machine of politics, intrigue, and treason that she does not understand. She only knows that she is beautiful, that men desire her, that she is young and in love -- but not with the diseased old man who made her queen, beds her night after night, and killed her cousin Anne. Her Boleyn Inheritance: the threat of the axe. JANE ROCHFORD She is the Boleyn girl whose testimony sent her husband and sister-in-law to their deaths. She is the trusted friend of two threatened queens, the perfectly loyal spy for her uncle, the Duke of Norfolk, and a canny survivor in the murderous court of a most dangerous king. Throughout Europe, her name is a byword for malice, jealousy, and twisted lust. Her Boleyn Inheritance: a fortune and a title, in exchange for her soul. The Boleyn Inheritance is a novel drawn tight as a lute string about a court ruled by the gallows and three women whose positions brought them wealth, admiration, and power as well as deceit, betrayal, and terror. Once again, Philippa Gregory has brought a vanished world to life -- the whisper of a silk skirt on a stone stair, the yellow glow of candlelight illuminating a hastily written note, the murmurs of the crowd gathering on Tower Green below the newly built scaffold. In The Boleyn Inheritance Gregory is at her intelligent and page-turning best.",['Fiction'],4,NOT_MATURE,596
Jane Eyre,['Charlotte Bronte'],fiction,No description,No category,0,Not rated,No data
World War Z,['Max Brooks'],fiction,An account of the decade-long conflict between humankind and hordes of the predatory undead is told from the perspective of dozens of survivors who describe in their own words the epic human battle for survival.,['Fiction'],3.5,NOT_MATURE,342
The Adventures of Tom Sawyer,['Mark Twain'],fiction,No description,No category,0,Not rated,No data
Palace Walk,['Naguib Mahfouz'],fiction,"Palace Walk is the first novel in Nobel Prize-winner Naguib Mahfouz’s magnificent Cairo Trilogy, an epic family saga of colonial Egypt that is considered his masterwork. The novels of the Cairo Trilogy trace three generations of the family of tyrannical patriarch al-Sayyid Ahmad Abd al-Jawad, who rules his household with a strict hand while living a secret life of self-indulgence. Palace Walk introduces us to his gentle, oppressed wife, Amina, his cloistered daughters, Aisha and Khadija, and his three sons—the tragic and idealistic Fahmy, the dissolute hedonist Yasin, and the soul-searching intellectual Kamal. The family’s trials mirror those of their turbulent country during the years spanning the two world wars, as change comes to a society that has resisted it for centuries. Translated by William Maynard Hutchins and Olive E. Kenny",['Fiction'],4,NOT_MATURE,546
Journey to the Center of the Earth,['Jules Verne'],fiction,"The intrepid Professor Lindenbrock embarks upon the strangest expedition of the nineteenth century: a journey down an extinct Icelandic volcano to the Earth’s very core. In his quest to penetrate the planet’s primordial secrets, the geologist—together with his quaking nephew Axel and their devoted guide, Hans—discovers an astonishing subterranean menagerie of prehistoric proportions. Verne’s imaginative tale is at once the ultimate science fiction adventure and a reflection on the perfectibility of human understanding and the psychology of the questor. As David Brin notes in his Introduction, though Verne never knew the term “science fiction,” Journey to the Centre of the Earth is “inarguably one of the wellsprings from which it all began.”",['Fiction'],3.5,NOT_MATURE,240
Leaves of Grass,['Walt Whitman'],fiction,No description,No category,0,Not rated,No data
Sir Gawain and the Green Knight,['J. A. Burrow'],fiction,"The Green Knight, a mysteriously powerful creature, tests the honor and courage of King Arthur's youngest knight.",['Poetry'],3,NOT_MATURE,182
Growth of the Soil,['Knut Hamsun'],fiction,The story of an elemental existence in rural Norway.,['Fiction'],5,NOT_MATURE,449
The Prince of Tides,['Pat Conroy'],fiction,"“A big, sprawling saga of a novel” (San Francisco Chronicle), this epic family drama is a masterwork by the revered author of The Great Santini. Pat Conroy’s classic novel stings with honesty and resounds with drama. Spanning forty years, it’s the story of turbulent Tom Wingo, his gifted and troubled twin sister, Savannah, and their struggle to triumph over the dark and tragic legacy of the extraordinary family into which they were born. Filled with the vanishing beauty of the South Carolina Low Country as well as the dusty glitter of New York City, The Prince of Tides showcases an American original at his very best. Praise for The Prince of Tides “This is a powerful book. . . . [Pat] Conroy is a master of language.”—The Atlanta Journal “A big, sprawling saga of a novel . . . the kind you can hole up with and spend some days with and put down feeling that you’ve emerged from a terrible, wonderful spell.”—San Francisco Chronicle “A literary gem . . . The Prince of Tides is in the best tradition of novel writing. It is an engrossing story of unforgettable characters.”—The Pittsburgh Press “A masterpiece.”—Detroit Free Press “Brilliant.”—Chicago Tribune",['Fiction'],4,NOT_MATURE,686
The Red Badge of Courage,['Stephen Crane'],fiction,"Small masterpiece set the pattern for the treatment of war in modern fiction. Amid the nightmarish chaos of a Civil War battle, a young soldier discovers courage, humility, and, perhaps, wisdom. Widely praised for uncanny re-creation of the sights, sounds, and sense of actual combat. An enduring landmark of American fiction.",['Fiction'],4,NOT_MATURE,113
My Antonia,['Willa Cather'],fiction,"In the late nineteenth century, a fourteen-year-old immigrant girl from Bohemia and a ten-year-old orphan boy arrive in Black Hawk, Nebraska, and in teaching each other form a friendship that will last a lifetime.",['Fiction'],4,NOT_MATURE,194
Science Fiction by Scientists,['Michael Brotherton'],science fiction,No description,No category,0,Not rated,No data
On the Origin of Stories,['Brian Boyd'],science fiction,"A century and a half after the publication of Origin of Species, evolutionary thinking has expanded beyond the field of biology to include virtually all human-related subjects—anthropology, archeology, psychology, economics, religion, morality, politics, culture, and art. Now a distinguished scholar offers the first comprehensive account of the evolutionary origins of art and storytelling. Brian Boyd explains why we tell stories, how our minds are shaped to understand them, and what difference an evolutionary understanding of human nature makes to stories we love. Art is a specifically human adaptation, Boyd argues. It offers tangible advantages for human survival, and it derives from play, itself an adaptation widespread among more intelligent animals. More particularly, our fondness for storytelling has sharpened social cognition, encouraged cooperation, and fostered creativity. After considering art as adaptation, Boyd examines Homer’s Odyssey and Dr. Seuss’s Horton Hears a Who! demonstrating how an evolutionary lens can offer new understanding and appreciation of specific works. What triggers our emotional engagement with these works? What patterns facilitate our responses? The need to hold an audience’s attention, Boyd underscores, is the fundamental problem facing all storytellers. Enduring artists arrive at solutions that appeal to cognitive universals: an insight out of step with contemporary criticism, which obscures both the individual and universal. Published for the bicentenary of Darwin’s birth and the 150th anniversary of the publication of Origin of Species, Boyd’s study embraces a Darwinian view of human nature and art, and offers a credo for a new humanism.",['Literary Criticism'],4,NOT_MATURE,555
"Wizards, Aliens, and Starships",['Charles L. Adler'],science fiction,Resource added for the ​Laboratory Science Technician program 105065.,['Mathematics'],5,NOT_MATURE,392
The Norton Book of Science Fiction,"['Ursula K. Le Guin', 'Brian Attebery']",science fiction,No description,No category,0,Not rated,No data
Comeuppance,['William Flesch'],science fiction,No description,No category,0,Not rated,No data
Fantastic Voyages,"['Leroy W. Dubeck', 'Suzanne E. Moshier', 'Judith E. Boss']",science fiction,No description,No category,0,Not rated,No data
Science Fact and Science Fiction,['Brian M. Stableford'],science fiction,Publisher description,['Literature and science'],5,NOT_MATURE,758
Ethical Futures and Global Science Fiction,"['Zachary Kendal', 'Aisling Smith', 'Giulia Champion', 'Andrew Milner']",science fiction,No description,No category,0,Not rated,No data
Teaching Science Fact with Science Fiction,['Gary Raham'],science fiction,No description,No category,0,Not rated,No data
H. G. Wells,['Herbert George Wells'],science fiction,No description,No category,0,Not rated,No data
Science Fiction and Futurism,['Ace G. Pilkington'],science fiction,No description,No category,0,Not rated,No data
Time Machines,['Paul J. Nahin'],science fiction,"This book explores the idea of time travel from the first account in English literature to the latest theories of physicists such as Kip Thorne and Igor Novikov. This very readable work covers a variety of topics including: the history of time travel in fiction; the fundamental scientific concepts of time, spacetime, and the fourth dimension; the speculations of Einstein, Richard Feynman, Kurt Goedel, and others; time travel paradoxes, and much more.",['Science'],4.5,NOT_MATURE,674
The Science of Science Fiction,['Mark Brake'],science fiction,No description,No category,0,Not rated,No data
Science Fiction: Vision of Tomorrow?,"['Richard Hantula', 'Isaac Asimov']",science fiction,No description,No category,0,Not rated,No data
Time Machine Tales,['Paul J. Nahin'],science fiction,No description,No category,0,Not rated,No data
Science Fact and Science Fiction,['Brian M. Stableford'],science fiction,Publisher description,['Literature and science'],5,NOT_MATURE,758
Ecosickness in Contemporary U.S. Fiction,['Heather Houser'],science fiction,No description,No category,0,Not rated,No data
Small Doses of the Future,['Brad Aiken'],science fiction,No description,No category,0,Not rated,No data
Different Engines,"['Mark Brake', 'Neil Hook']",science fiction,No description,No category,0,Not rated,No data
Teaching Science Fact with Science Fiction,['Gary Raham'],science fiction,No description,No category,0,Not rated,No data
